{
  "schemaVersion": 1,
  "assetId": "hibiscus-purple",
  "curriculumPurpose": "Replace prototype hibiscus-purple with an original HIBEYA production asset.",
  "ageBands": [
    "4-5",
    "6-7"
  ],
  "subject": "hibiscus purple",
  "interactionRole": "learning-object",
  "visualBrief": {
    "description": "Original child-readable HIBEYA illustration of hibiscus purple, designed as a clear learning object.",
    "composition": "Single dominant object with strong silhouette and generous negative space.",
    "background": "transparent",
    "avoid": [
      "text",
      "logos",
      "watermarks",
      "protected characters",
      "celebrity likenesses",
      "photorealistic clutter",
      "unnecessary decorative detail"
    ]
  },
  "malaysianContext": [
    "bunga raya",
    "Malaysian national flower context"
  ],
  "culturalReviewRequired": true,
  "variants": [
    "default"
  ],
  "masterFormat": "svg",
  "runtimeFormats": [
    "svg",
    "webp"
  ],
  "productionMethod": "original-internal",
  "status": "review"
}
