{
  "schemaVersion": 1,
  "assetId": "banana-yellow",
  "curriculumPurpose": "Replace prototype banana-yellow with an original HIBEYA production asset.",
  "ageBands": [
    "4-5",
    "6-7"
  ],
  "subject": "banana yellow",
  "interactionRole": "learning-object",
  "visualBrief": {
    "description": "Original child-readable HIBEYA illustration of banana yellow, designed as a clear learning object.",
    "composition": "Single dominant object with strong silhouette and generous negative space.",
    "background": "transparent",
    "avoid": [
      "text",
      "logos",
      "watermarks",
      "protected characters",
      "celebrity likenesses",
      "photorealistic clutter",
      "unnecessary decorative detail"
    ]
  },
  "malaysianContext": [],
  "culturalReviewRequired": false,
  "variants": [
    "default"
  ],
  "masterFormat": "svg",
  "runtimeFormats": [
    "svg",
    "webp"
  ],
  "productionMethod": "original-internal",
  "status": "production"
}
